{
  "schema_version": "1.0",
  "source_id": "03-manage-your-emotional-memories",
  "source_filename": "03_Manage-Your-Emotional-Memories.txt",
  "source_type": "unknown",
  "source_language": "en",
  "source_format": "txt",
  "source_sha256": "585e5fccbe7d6183c5dc7cdf29d8f6578e56d5b96341ecd40e5e065600c05527",
  "raw_artifact": "03-manage-your-emotional-memories.raw.txt",
  "offset_basis": "character offsets (Python str indices / Unicode code points) into the raw file decoded as utf-8, BOM removed, original line endings kept",
  "source_metadata": {
    "source_url": "https://www.youtube.com/watch?v=VyMXLvZwNPo",
    "video_id": "VyMXLvZwNPo",
    "title": "Manage Your Emotional Memories | Param Gurudev's English Session with California State University"
  },
  "timestamps_available": false,
  "speakers_available": true,
  "cleaning_status": "complete",
  "review_required": false,
  "warnings": [
    {
      "code": "speaker_labels_anonymous",
      "message": "Speaker labels are kept exactly as written (e.g. 'Speaker 1'); they are not mapped to real identities."
    },
    {
      "code": "duplicate_consecutive_chunk",
      "message": "Identical to the previous chunk (03-manage-your-emotional-memories-0063).",
      "chunk_id": "03-manage-your-emotional-memories-0064"
    },
    {
      "code": "duplicate_consecutive_chunk",
      "message": "Identical to the previous chunk (03-manage-your-emotional-memories-0151).",
      "chunk_id": "03-manage-your-emotional-memories-0152"
    }
  ],
  "chunks": [
    {
      "chunk_id": "03-manage-your-emotional-memories-0001",
      "text": "Hello Hi students The California State University where Professor Jonathan Young has invited to take a session on philosophy and religious studies Today, first of all, I would like to appreciate your curiosity to learn something about Jainism.",
      "start_time": null,
      "end_time": null,
      "speaker_id": "Speaker 1",
      "turn_index": 0,
      "source_start_offset": 169,
      "source_end_offset": 412,
      "cue_indices": null,
      "cue_ids": null,
      "skip_translation_spans": [],
      "uncertainty_flags": [],
      "edit_notes": []
    },
    {
      "chunk_id": "03-manage-your-emotional-memories-0002",
      "text": "I truly believe that Jainism is Not a religion But it is a philosophy and a way of living.",
      "start_time": null,
      "end_time": null,
      "speaker_id": "Speaker 1",
      "turn_index": 0,
      "source_start_offset": 413,
      "source_end_offset": 503,
      "cue_indices": null,
      "cue_ids": null,
      "skip_translation_spans": [],
      "uncertainty_flags": [],
      "edit_notes": []
    },
    {
      "chunk_id": "03-manage-your-emotional-memories-0003",
      "text": "Whenever we do any action It creates an image.",
      "start_time": null,
      "end_time": null,
      "speaker_id": "Speaker 1",
      "turn_index": 0,
      "source_start_offset": 504,
      "source_end_offset": 550,
      "cue_indices": null,
      "cue_ids": null,
      "skip_translation_spans": [],
      "uncertainty_flags": [],
      "edit_notes": []
    },
    {
      "chunk_id": "03-manage-your-emotional-memories-0004",
      "text": "an impression in your mind.",
      "start_time": null,
      "end_time": null,
      "speaker_id": "Speaker 1",
      "turn_index": 0,
      "source_start_offset": 551,
      "source_end_offset": 578,
      "cue_indices": null,
      "cue_ids": null,
      "skip_translation_spans": [],
      "uncertainty_flags": [],
      "edit_notes": []
    },
    {
      "chunk_id": "03-manage-your-emotional-memories-0005",
      "text": "You must have seen that whenever water splits from a glass, it starts flowing in one direction and then it dries up.",
      "start_time": null,
      "end_time": null,
      "speaker_id": "Speaker 1",
      "turn_index": 0,
      "source_start_offset": 579,
      "source_end_offset": 695,
      "cue_indices": null,
      "cue_ids": null,
      "skip_translation_spans": [],
      "uncertainty_flags": [],
      "edit_notes": []
    },
    {
      "chunk_id": "03-manage-your-emotional-memories-0006",
      "text": "but If you again pour water in that same place, you must have marked that it starts flowing in the same path, same direction that is had created before.",
      "start_time": null,
      "end_time": null,
      "speaker_id": "Speaker 1",
      "turn_index": 0,
      "source_start_offset": 696,
      "source_end_offset": 848,
      "cue_indices": null,
      "cue_ids": null,
      "skip_translation_spans": [],
      "uncertainty_flags": [],
      "edit_notes": []
    },
    {
      "chunk_id": "03-manage-your-emotional-memories-0007",
      "text": "Why?",
      "start_time": null,
      "end_time": null,
      "speaker_id": "Speaker 1",
      "turn_index": 0,
      "source_start_offset": 849,
      "source_end_offset": 853,
      "cue_indices": null,
      "cue_ids": null,
      "skip_translation_spans": [],
      "uncertainty_flags": [],
      "edit_notes": []
    },
    {
      "chunk_id": "03-manage-your-emotional-memories-0008",
      "text": "Because Though the water had dried up, it still created and left back an image.",
      "start_time": null,
      "end_time": null,
      "speaker_id": "Speaker 1",
      "turn_index": 0,
      "source_start_offset": 854,
      "source_end_offset": 933,
      "cue_indices": null,
      "cue_ids": null,
      "skip_translation_spans": [],
      "uncertainty_flags": [],
      "edit_notes": []
    },
    {
      "chunk_id": "03-manage-your-emotional-memories-0009",
      "text": "So now When you again poured water over it, it flowed in the same path of the impression.",
      "start_time": null,
      "end_time": null,
      "speaker_id": "Speaker 1",
      "turn_index": 0,
      "source_start_offset": 934,
      "source_end_offset": 1023,
      "cue_indices": null,
      "cue_ids": null,
      "skip_translation_spans": [],
      "uncertainty_flags": [],
      "edit_notes": []
    },
    {
      "chunk_id": "03-manage-your-emotional-memories-0010",
      "text": "What is this impression?",
      "start_time": null,
      "end_time": null,
      "speaker_id": "Speaker 1",
      "turn_index": 0,
      "source_start_offset": 1024,
      "source_end_offset": 1048,
      "cue_indices": null,
      "cue_ids": null,
      "skip_translation_spans": [],
      "uncertainty_flags": [],
      "edit_notes": []
    },
    {
      "chunk_id": "03-manage-your-emotional-memories-0011",
      "text": "It's nothing but memory.",
      "start_time": null,
      "end_time": null,
      "speaker_id": "Speaker 1",
      "turn_index": 0,
      "source_start_offset": 1049,
      "source_end_offset": 1073,
      "cue_indices": null,
      "cue_ids": null,
      "skip_translation_spans": [],
      "uncertainty_flags": [],
      "edit_notes": []
    },
    {
      "chunk_id": "03-manage-your-emotional-memories-0012",
      "text": "The action got over but it left an impression.",
      "start_time": null,
      "end_time": null,
      "speaker_id": "Speaker 1",
      "turn_index": 0,
      "source_start_offset": 1074,
      "source_end_offset": 1120,
      "cue_indices": null,
      "cue_ids": null,
      "skip_translation_spans": [],
      "uncertainty_flags": [],
      "edit_notes": []
    },
    {
      "chunk_id": "03-manage-your-emotional-memories-0013",
      "text": "Same thing happens with our life too.",
      "start_time": null,
      "end_time": null,
      "speaker_id": "Speaker 1",
      "turn_index": 0,
      "source_start_offset": 1121,
      "source_end_offset": 1158,
      "cue_indices": null,
      "cue_ids": null,
      "skip_translation_spans": [],
      "uncertainty_flags": [],
      "edit_notes": []
    },
    {
      "chunk_id": "03-manage-your-emotional-memories-0014",
      "text": "When we get angry, after getting angry the act is over, but It leaves behind an impression of getting angry which gets saved in the form of memories.",
      "start_time": null,
      "end_time": null,
      "speaker_id": "Speaker 1",
      "turn_index": 0,
      "source_start_offset": 1159,
      "source_end_offset": 1308,
      "cue_indices": null,
      "cue_ids": null,
      "skip_translation_spans": [],
      "uncertainty_flags": [],
      "edit_notes": []
    },
    {
      "chunk_id": "03-manage-your-emotional-memories-0015",
      "text": "So now Whenever you do any action of getting angry, it gets connected with this impression which is set in your mind.",
      "start_time": null,
      "end_time": null,
      "speaker_id": "Speaker 1",
      "turn_index": 0,
      "source_start_offset": 1309,
      "source_end_offset": 1426,
      "cue_indices": null,
      "cue_ids": null,
      "skip_translation_spans": [],
      "uncertainty_flags": [],
      "edit_notes": []
    },
    {
      "chunk_id": "03-manage-your-emotional-memories-0016",
      "text": "And hence, because of linking to the same impression, it opens the same file of getting angry and then you react.",
      "start_time": null,
      "end_time": null,
      "speaker_id": "Speaker 1",
      "turn_index": 0,
      "source_start_offset": 1427,
      "source_end_offset": 1540,
      "cue_indices": null,
      "cue_ids": null,
      "skip_translation_spans": [],
      "uncertainty_flags": [],
      "edit_notes": []
    },
    {
      "chunk_id": "03-manage-your-emotional-memories-0017",
      "text": "Now, tell me one thing.",
      "start_time": null,
      "end_time": null,
      "speaker_id": "Speaker 1",
      "turn_index": 0,
      "source_start_offset": 1541,
      "source_end_offset": 1564,
      "cue_indices": null,
      "cue_ids": null,
      "skip_translation_spans": [],
      "uncertainty_flags": [],
      "edit_notes": []
    },
    {
      "chunk_id": "03-manage-your-emotional-memories-0018",
      "text": "Then you boil water, its temperature increases, but slowly slowly after some time, it comes back to its normal room temperature, right?",